{
  "courseId": "trading-fundamentals",
  "name": "AOM Trading Fundamentals Course",
  "description": "Comprehensive trading education covering all essential aspects of trading",
  "version": "1.0.0",
  "chapters": [
    {
      "chapterId": "trading-basics",
      "name": "Fundamentls of trading",
      "description": "Fundamental concepts reading the market",
      "order": 0,
      "lessons": [
        {
          "lessonId": "introduction-to-trading",
          "name": "Lesson 1: Introduction to AOM Trading Methodology",
          "description": "Learn the core principles and methodology behind AOM Trading",
          "order": 0,
          "contentType": "text",
          "contentPath": "/lessons/trading-basics/introduction-to-trading.md",
          "estimatedMinutes": 15
        },
        {
          "lessonId": "market-participants",
          "name": "Lesson 2: Multi-timeframe Analysis",
          "description": "Understanding how different timeframes interact and special cases for trading",
          "order": 1,
          "contentType": "text",
          "contentPath": "/lessons/trading-basics/market-participants.md",
          "estimatedMinutes": 20
        }
      ],
      "quizzes": [
        {
          "quizId": "trading-basics-quiz-1",
          "name": "Chapter 1 Quiz",
          "description": "Test your understanding of AOM Trading Methodology and Multi-timeframe Analysis",
          "order": 0,
          "passingScore": 75,
          "maxAttempts": 3,
          "questions": [
            {
              "questionId": "ch1-q1",
              "text": "What is the main goal of using a Top-Down Approach in trading? (Select all that apply)",
              "type": "multiple-choice",
              "order": 0,
              "points": 1,
              "options": [
                {
                  "optionId": "ch1-q1-a",
                  "text": "To create a structured and repeatable decision-making process.",
                  "isCorrect": true,
                  "order": 0
                },
                {
                  "optionId": "ch1-q1-b",
                  "text": "To build trader competence and confidence.",
                  "isCorrect": true,
                  "order": 1
                },
                {
                  "optionId": "ch1-q1-c",
                  "text": "To increase the number of trades taken each day.",
                  "isCorrect": false,
                  "order": 2
                },
                {
                  "optionId": "ch1-q1-d",
                  "text": "To support independent, informed trading decisions.",
                  "isCorrect": true,
                  "order": 3
                }
              ]
            },
            {
              "questionId": "ch1-q2",
              "text": "How do the three timeframes (BTF, ATF, ETF) work together in market analysis? (Select all that apply)",
              "type": "multiple-choice",
              "order": 1,
              "points": 1,
              "options": [
                {
                  "optionId": "ch1-q2-a",
                  "text": "BTF (Boundary Time Frame) defines the large-scale context and major supply/demand zones.",
                  "isCorrect": true,
                  "order": 0
                },
                {
                  "optionId": "ch1-q2-b",
                  "text": "ATF (Analysis Time Frame) identifies high-probability zones using wave theory and structure.",
                  "isCorrect": true,
                  "order": 1
                },
                {
                  "optionId": "ch1-q2-c",
                  "text": "ETF (Execution Time Frame) refines entries for better risk/reward within ATF zones.",
                  "isCorrect": true,
                  "order": 2
                },
                {
                  "optionId": "ch1-q2-d",
                  "text": "All three are used randomly depending on the trader's mood.",
                  "isCorrect": false,
                  "order": 3
                }
              ]
            },
            {
              "questionId": "ch1-q3",
              "text": "Why does analysis typically start with the ATF? (Select all that apply)",
              "type": "multiple-choice",
              "order": 2,
              "points": 1,
              "options": [
                {
                  "optionId": "ch1-q3-a",
                  "text": "It provides the clearest mix of market context and actionable data.",
                  "isCorrect": true,
                  "order": 0
                },
                {
                  "optionId": "ch1-q3-b",
                  "text": "It defines the high-probability zones for trade planning.",
                  "isCorrect": true,
                  "order": 1
                },
                {
                  "optionId": "ch1-q3-c",
                  "text": "It's the smallest timeframe, so it reacts faster to price changes.",
                  "isCorrect": false,
                  "order": 2
                },
                {
                  "optionId": "ch1-q3-d",
                  "text": "It bridges long-term context (BTF) with short-term precision (ETF).",
                  "isCorrect": true,
                  "order": 3
                }
              ]
            },
            {
              "questionId": "ch1-q4",
              "text": "When should a trader use the ETF instead of the full ATF zone? (Select all that apply)",
              "type": "multiple-choice",
              "order": 3,
              "points": 1,
              "options": [
                {
                  "optionId": "ch1-q4-a",
                  "text": "When the trading account is small and risk must be reduced.",
                  "isCorrect": true,
                  "order": 0
                },
                {
                  "optionId": "ch1-q4-b",
                  "text": "When the ETF zone aligns with the ATF direction but is narrower in size.",
                  "isCorrect": true,
                  "order": 1
                },
                {
                  "optionId": "ch1-q4-c",
                  "text": "When the trader wants to gamble on quick trades.",
                  "isCorrect": false,
                  "order": 2
                },
                {
                  "optionId": "ch1-q4-d",
                  "text": "When refining entries to optimize reward-to-risk inside the ATF zone.",
                  "isCorrect": true,
                  "order": 3
                }
              ]
            }
          ]
        }
      ]
    },
    {
      "chapterId": "technical-analysis",
      "name": "Technical Analysis",
      "description": "Chart patterns, indicators, and technical analysis techniques",
      "order": 1,
      "lessons": [
        {
          "lessonId": "reading-charts",
          "name": "Lesson 1: Introduction to Supply and Demand",
          "description": "Learn the core market forces and how supply and demand zones work",
          "order": 0,
          "contentType": "text",
          "contentPath": "/lessons/technical-analysis/reading-charts.md",
          "estimatedMinutes": 25
        },
        {
          "lessonId": "support-resistance",
          "name": "Lesson 2: Consolidation Patterns",
          "description": "Understanding consolidation patterns and breakout direction",
          "order": 1,
          "contentType": "text",
          "contentPath": "/lessons/technical-analysis/support-resistance.md",
          "estimatedMinutes": 30
        }
      ],
      "quizzes": [
        {
          "quizId": "technical-analysis-quiz-1",
          "name": "Chapter 2 Quiz",
          "description": "Test your understanding of Supply and Demand and Consolidation Patterns",
          "order": 0,
          "passingScore": 75,
          "maxAttempts": 3,
          "questions": [
            {
              "questionId": "ch2-q1",
              "text": "What does a Supply Zone represent in market structure? (Select all that apply)",
              "type": "multiple-choice",
              "order": 0,
              "points": 1,
              "options": [
                {
                  "optionId": "ch2-q1-a",
                  "text": "An area where institutional traders accumulate long positions.",
                  "isCorrect": false,
                  "order": 0
                },
                {
                  "optionId": "ch2-q1-b",
                  "text": "A price region where selling pressure exceeds buying interest.",
                  "isCorrect": true,
                  "order": 1
                },
                {
                  "optionId": "ch2-q1-c",
                  "text": "A location where price often reverses after a rally.",
                  "isCorrect": true,
                  "order": 2
                },
                {
                  "optionId": "ch2-q1-d",
                  "text": "A consolidation area before a bullish breakout.",
                  "isCorrect": false,
                  "order": 3
                }
              ]
            },
            {
              "questionId": "ch2-q2",
              "text": "Which statement best describes an Imbalance in price action? (Select all that apply)",
              "type": "multiple-choice",
              "order": 1,
              "points": 1,
              "options": [
                {
                  "optionId": "ch2-q2-a",
                  "text": "It occurs when #Buyers = #Sellers.",
                  "isCorrect": false,
                  "order": 0
                },
                {
                  "optionId": "ch2-q2-b",
                  "text": "It drives rapid price movement in the dominant direction.",
                  "isCorrect": true,
                  "order": 1
                },
                {
                  "optionId": "ch2-q2-c",